{
  "$schema": "../recipe.schema.json",
  "schemaVersion": 1,

  "meta": {
    "name": "Atlas 25H2 RU",
    "description": "Windows 11 Pro 25H2 ru-RU, чистая установка, Atlas через ISO-injection, Windhawk с модами таскбара. Хеши заполняются автоматически при сборке носителя в WindowsPeace.Studio.",
    "author": "mnogolet",
    "revision": 1
  },

  "source": {
    "windows": {
      "edition": "Pro",
      "version": "25H2",
      "arch": "x64",
      "language": "ru-RU",
      "imageName": "Windows 11 Pro",
      "iso": {
        "url": "https://www.microsoft.com/software-download/windows11",
        "sha256": "0000000000000000000000000000000000000000000000000000000000000000"
      }
    }
  },

  "target": {
    "firmware": "uefi",

    "diskSelection": {
      "mode": "interactive",
      "excludeBootMedia": true,
      "excludeRemovable": true
    },

    "layout": {
      "espMB": 300,
      "msrMB": 16,
      "recoveryMB": 1024,
      "recoveryPlacement": "end",
      "windowsSizeGB": null
    },

    "bootCleanup": {
      "removeStaleFirmwareEntries": true,
      "setFirstBootEntry": true,
      "wipeOtherEsps": false
    }
  },

  "unattend": {
    "uiLanguage": "ru-RU",
    "systemLocale": "en-US",
    "userLocale": "en-US",
    "geoLocation": 203,
    "keyboards": ["0409:00000409", "0419:00000419"],
    "timezone": "Russian Standard Time",
    "computerName": null,
    "accounts": [
      {
        "name": "user",
        "group": "Administrators",
        "passwordMode": "promptAtDeploy",
        "autoLogon": true
      }
    ],
    "skipOobe": true,
    "bypassMsAccount": true,
    "skipPrivacyPrompts": true,
    "bypassHardwareChecks": false
  },

  "drivers": {
    "peDrivers": [],
    "osDrivers": []
  },

  "postInstall": {
    "steps": [
      {
        "id": "drivers",
        "type": "drivers.install",
        "reboot": "ifRequested"
      },
      {
        "id": "updates",
        "type": "windowsUpdate.converge",
        "maxCycles": 3,
        "includeDrivers": true,
        "includeStoreApps": true,
        "reboot": "ifRequested",
        "timeoutMinutes": 120
      },
      {
        "id": "atlas",
        "type": "atlas.apply",
        "strategy": "isoInjection",
        "fallbackStrategy": "wizardAssisted",
        "playbook": {
          "url": "https://atlasos.net/",
          "sha256": "0000000000000000000000000000000000000000000000000000000000000000"
        },
        "onError": "abort",
        "reboot": "always",
        "timeoutMinutes": 90
      },
      {
        "id": "windhawk",
        "type": "windhawk.install",
        "portable": false,
        "mods": [
          { "id": "taskbar-clock-customization" },
          { "id": "windows-11-taskbar-styler" }
        ],
        "onError": "continue"
      },
      {
        "id": "apps",
        "type": "apps.install",
        "manager": "winget",
        "packages": [
          "Mozilla.Firefox",
          "7zip.7zip"
        ],
        "onError": "continue"
      }
    ]
  },

  "safety": {
    "dryRun": false,
    "requireTypedConfirmation": true,
    "onDataVolumesFound": "confirm",
    "onOtherWindowsFound": "confirm"
  }
}
